{
  "ticker": "KUKZ",
  "range": "1y",
  "price_basis": "vwap",
  "dates": [
    "2025-10-06",
    "2025-10-07",
    "2025-10-08",
    "2025-10-09",
    "2025-10-13",
    "2025-10-14",
    "2025-10-15",
    "2025-10-16",
    "2025-10-21",
    "2025-10-22",
    "2025-10-23",
    "2025-10-24",
    "2025-10-27",
    "2025-10-28",
    "2025-10-29",
    "2025-10-30",
    "2025-10-31",
    "2025-11-03",
    "2025-11-04",
    "2025-11-05",
    "2025-11-06",
    "2025-11-07",
    "2025-11-10",
    "2025-11-11",
    "2025-11-12",
    "2025-11-13",
    "2025-11-14",
    "2025-11-17",
    "2025-11-18",
    "2025-11-19",
    "2025-11-20",
    "2025-11-21",
    "2025-11-24",
    "2025-11-25",
    "2025-11-26",
    "2025-11-27",
    "2025-11-28",
    "2025-12-01",
    "2025-12-02",
    "2025-12-03",
    "2025-12-04",
    "2025-12-05",
    "2025-12-08",
    "2025-12-09",
    "2025-12-10",
    "2025-12-11",
    "2025-12-15",
    "2025-12-16",
    "2025-12-17",
    "2025-12-18",
    "2025-12-19",
    "2025-12-22",
    "2025-12-23",
    "2025-12-24",
    "2025-12-29",
    "2025-12-30",
    "2025-12-31",
    "2026-01-02",
    "2026-01-05",
    "2026-01-06",
    "2026-01-07",
    "2026-01-08",
    "2026-01-09",
    "2026-01-12",
    "2026-01-13",
    "2026-01-14",
    "2026-01-15",
    "2026-01-16",
    "2026-01-19",
    "2026-01-20",
    "2026-01-21",
    "2026-01-22",
    "2026-01-23",
    "2026-01-26",
    "2026-01-27",
    "2026-01-28",
    "2026-01-29",
    "2026-01-30",
    "2026-02-02",
    "2026-02-03",
    "2026-02-04",
    "2026-02-05",
    "2026-02-06",
    "2026-02-09",
    "2026-02-10",
    "2026-02-11",
    "2026-02-12",
    "2026-02-13",
    "2026-02-16",
    "2026-02-17",
    "2026-02-18",
    "2026-02-19",
    "2026-02-20",
    "2026-02-23",
    "2026-02-24",
    "2026-02-25",
    "2026-02-26",
    "2026-02-27",
    "2026-03-02",
    "2026-03-03",
    "2026-03-04",
    "2026-03-05",
    "2026-03-06",
    "2026-03-09",
    "2026-03-10",
    "2026-03-11",
    "2026-03-12",
    "2026-03-13",
    "2026-03-16",
    "2026-03-17",
    "2026-03-18",
    "2026-03-19",
    "2026-03-23",
    "2026-03-24",
    "2026-03-25",
    "2026-03-26",
    "2026-03-27",
    "2026-03-30",
    "2026-03-31",
    "2026-04-01",
    "2026-04-02",
    "2026-04-07",
    "2026-04-08",
    "2026-04-09",
    "2026-04-10",
    "2026-04-13",
    "2026-04-14",
    "2026-04-15",
    "2026-04-16",
    "2026-04-17",
    "2026-04-20",
    "2026-04-21",
    "2026-04-22",
    "2026-04-23",
    "2026-04-24",
    "2026-04-27",
    "2026-04-28",
    "2026-04-29",
    "2026-04-30",
    "2026-05-04",
    "2026-05-05",
    "2026-05-06",
    "2026-05-07",
    "2026-05-08",
    "2026-05-11",
    "2026-05-12",
    "2026-05-13",
    "2026-05-14",
    "2026-05-15",
    "2026-05-18",
    "2026-05-19",
    "2026-05-20",
    "2026-05-21",
    "2026-05-22",
    "2026-05-25",
    "2026-05-26",
    "2026-05-28",
    "2026-05-29",
    "2026-06-02",
    "2026-06-03",
    "2026-06-04",
    "2026-06-05",
    "2026-06-08",
    "2026-06-09",
    "2026-06-10",
    "2026-06-11",
    "2026-06-12",
    "2026-06-15",
    "2026-06-16",
    "2026-06-17",
    "2026-06-18",
    "2026-06-19",
    "2026-06-22",
    "2026-06-23",
    "2026-06-24",
    "2026-06-25",
    "2026-06-26",
    "2026-06-29",
    "2026-06-30",
    "2026-07-01",
    "2026-07-02",
    "2026-07-03",
    "2026-07-06",
    "2026-07-07",
    "2026-07-08",
    "2026-07-09",
    "2026-07-10",
    "2026-07-13",
    "2026-07-14",
    "2026-07-15",
    "2026-07-16",
    "2026-07-17",
    "2026-07-20",
    "2026-07-21",
    "2026-07-22",
    "2026-07-23",
    "2026-07-24",
    "2026-07-27",
    "2026-07-28",
    "2026-07-29",
    "2026-07-30",
    "2026-07-31",
    "2026-08-03",
    "2026-08-04",
    "2026-08-05",
    "2026-08-06",
    "2026-08-07",
    "2026-08-10",
    "2026-08-11",
    "2026-08-12",
    "2026-08-13",
    "2026-08-14",
    "2026-08-17",
    "2026-08-18",
    "2026-08-19",
    "2026-08-20",
    "2026-08-21",
    "2026-08-24",
    "2026-08-25",
    "2026-08-26",
    "2026-08-27",
    "2026-08-28",
    "2026-08-31",
    "2026-09-01",
    "2026-09-02",
    "2026-09-03",
    "2026-09-04",
    "2026-09-07",
    "2026-09-08",
    "2026-09-09",
    "2026-09-10",
    "2026-09-11",
    "2026-09-14",
    "2026-09-15",
    "2026-09-16",
    "2026-09-17",
    "2026-09-18",
    "2026-09-21",
    "2026-09-22",
    "2026-09-23",
    "2026-09-24",
    "2026-09-25",
    "2026-09-28",
    "2026-09-29",
    "2026-09-30",
    "2026-10-01",
    "2026-10-02",
    "2026-10-05",
    "2026-10-06",
    "2026-10-07"
  ],
  "close": [
    431.52,
    431.52,
    431.52,
    431.52,
    431.52,
    431.52,
    431.52,
    446.35,
    446.35,
    446.35,
    443.22,
    443.22,
    443.58,
    442.86,
    442.86,
    442.86,
    442.56,
    442.65,
    442.65,
    442.65,
    442.65,
    442.65,
    451.08,
    451.08,
    451.08,
    458.61,
    458.61,
    458.61,
    458.61,
    458.61,
    458.61,
    458.61,
    458.61,
    455.92,
    455.92,
    455.92,
    455.92,
    458.9,
    460.22,
    464.81,
    464.81,
    464.81,
    464.81,
    472.28,
    473.59,
    474.97,
    474.97,
    473.14,
    471.75,
    471.75,
    471.75,
    471.75,
    471.75,
    471.75,
    478.62,
    478.62,
    478.62,
    486.3,
    489.87,
    489.87,
    489.87,
    489.87,
    489.87,
    489.87,
    498.04,
    498.04,
    498.04,
    498.04,
    498.04,
    493.35,
    493.35,
    495.7,
    495.7,
    498.15,
    498.15,
    498.15,
    498.15,
    499.8,
    510.16,
    515.25,
    515.25,
    516.98,
    516.98,
    516.98,
    516.98,
    516.98,
    508.82,
    508.82,
    508.82,
    508.82,
    504.44,
    504.44,
    504.44,
    504.44,
    504.44,
    504.44,
    504.44,
    506.41,
    506.41,
    506.41,
    506.41,
    506.41,
    506.0,
    506.0,
    508.27,
    508.27,
    508.27,
    508.27,
    508.27,
    508.27,
    508.27,
    508.27,
    506.04,
    506.04,
    506.04,
    506.04,
    506.04,
    506.11,
    506.11,
    506.11,
    506.11,
    506.11,
    506.24,
    510.14,
    510.14,
    510.14,
    519.69,
    519.69,
    519.69,
    519.69,
    519.69,
    518.22,
    512.6,
    516.31,
    516.31,
    516.31,
    516.31,
    512.42,
    512.42,
    512.37,
    512.37,
    512.37,
    512.37,
    512.37,
    512.37,
    512.12,
    512.12,
    512.12,
    505.13,
    505.13,
    515.24,
    515.24,
    521.12,
    521.12,
    521.12,
    512.67,
    512.67,
    512.67,
    508.75,
    516.65,
    516.65,
    516.65,
    521.43,
    521.43,
    521.43,
    517.83,
    526.29,
    529.69,
    529.69,
    529.69,
    529.69,
    529.69,
    539.57,
    532.59,
    538.36,
    538.36,
    538.36,
    538.36,
    538.36,
    538.36,
    538.36,
    538.36,
    538.36,
    538.36,
    538.36,
    538.36,
    527.25,
    529.56,
    529.56,
    529.56,
    529.56,
    529.56,
    529.64,
    529.64,
    529.64,
    525.02,
    525.02,
    525.02,
    525.02,
    525.02,
    525.02,
    521.18,
    525.51,
    537.17,
    537.17,
    537.17,
    537.17,
    534.6,
    534.6,
    539.69,
    539.69,
    539.69,
    539.69,
    539.69,
    539.69,
    539.69,
    539.69,
    539.69,
    541.31,
    549.28,
    549.28,
    548.9,
    561.26,
    567.66,
    567.66,
    567.66,
    567.66,
    567.66,
    567.66,
    567.66,
    569.55,
    569.55,
    569.55,
    569.55,
    569.55,
    569.55,
    569.55,
    569.55,
    569.55,
    569.55,
    569.55,
    583.74,
    583.74,
    583.74,
    583.74,
    590.97,
    592.75,
    592.75,
    586.73,
    586.73
  ],
  "volume": [
    249536,
    0,
    0,
    0,
    0,
    0,
    0,
    199975,
    0,
    0,
    78816,
    0,
    175427,
    640338,
    0,
    0,
    713792,
    298493,
    0,
    0,
    0,
    0,
    127705,
    0,
    0,
    305788,
    0,
    0,
    0,
    0,
    0,
    0,
    0,
    670785,
    0,
    0,
    0,
    132837,
    145416,
    81264,
    0,
    0,
    0,
    367846,
    625670,
    155356,
    0,
    446837,
    477075,
    0,
    0,
    0,
    0,
    0,
    557019,
    0,
    0,
    218781,
    528974,
    0,
    0,
    0,
    0,
    0,
    128167,
    0,
    0,
    0,
    0,
    311374,
    0,
    250710,
    0,
    327471,
    0,
    0,
    0,
    752110,
    659748,
    106654,
    0,
    255557,
    0,
    0,
    0,
    0,
    206090,
    0,
    0,
    0,
    229785,
    0,
    0,
    0,
    0,
    0,
    0,
    88897,
    0,
    0,
    0,
    0,
    361005,
    0,
    4068328,
    0,
    0,
    0,
    0,
    0,
    0,
    0,
    310594,
    0,
    0,
    0,
    0,
    32164,
    0,
    0,
    0,
    0,
    390915,
    115663,
    0,
    0,
    124431,
    0,
    0,
    0,
    0,
    275902,
    192192,
    859597,
    0,
    0,
    0,
    1506982,
    0,
    428581,
    0,
    0,
    0,
    0,
    0,
    147698,
    0,
    0,
    844986,
    0,
    1559015,
    0,
    226024,
    0,
    0,
    157421,
    0,
    0,
    177535,
    1300490,
    0,
    0,
    1120106,
    0,
    0,
    227426,
    126987,
    30362,
    0,
    0,
    0,
    0,
    289460,
    485414,
    341842,
    0,
    0,
    0,
    0,
    0,
    0,
    0,
    0,
    0,
    0,
    0,
    394752,
    90596,
    0,
    0,
    0,
    0,
    1140593,
    0,
    0,
    150995,
    0,
    0,
    0,
    0,
    0,
    172790,
    128593,
    308963,
    0,
    0,
    0,
    432373,
    0,
    125384,
    0,
    0,
    0,
    0,
    0,
    0,
    0,
    0,
    218184,
    97956,
    0,
    121017,
    760953,
    199612,
    0,
    0,
    0,
    0,
    0,
    0,
    185019,
    0,
    0,
    0,
    0,
    0,
    0,
    0,
    0,
    0,
    0,
    191225,
    0,
    0,
    0,
    917189,
    695373,
    0,
    196019,
    0
  ],
  "events": []
}
